id;title;date;view_count;rating;content;is_full_content;category
27596212;Yemeksepeti İşletmemden Kesilen Yüksek Tutardaki Komisyon Ücreti;16 Ocak 2024 20:49;4.652;;"Yemeksepeti ile çalışmaya 1 ay önce başladım. Bu hafta 21.450 TL ciro yaptım ancak bugün bana sadece 5.000 TL ödeme yapıldı. Müşteri hizmetleri ni arayarak durumu dile getirdim; ancak yetkili kişilere bildirim yapıldığından başka bir şekilde yardımcı olunmadı. Yüzde 45 komisyon alınacağını biliyorum. Hesaplamalara göre bana 9.652,50 TL ödeme yapılması gerekiyordu. Fakat hesabıma yatan miktarın 11.797,50 TL olması gerekiyor.";True;komisyon
27529694;Yemeksepeti Restoran Başvuru Pişmanlığı;10 Ocak 2024 17:20;1.979;1.0;"Restoran başvuru süreci labirent gibi; muhatap yok. Yeni başvurularda 'kendi kuryenizle çalışamazsınız' deniyor, adeta dalga geçer gibi. İlk yedi gün komisyon kesilmeyecek deniliyor fakat bu yedi günü başvurduğunuz gün başlatıp, daha restoranı açmadan on gün geçiyor. Zaten menülerde görsel zorunluluğu koyulmuş. İşletmeciyi geçtim, grafik tasarımcı getirseniz bile o görseli kabul ettiremezsiniz. İki farklı model telefon ve fotoğraf makinesiyle çekip yükledik; ne yaparsak yapalım 'istenilen formatta değil' deniliyor. Artık kazandıkları para onları doyurmaya başlamış herhalde ki; yüz yüze, insan yerine koyup görüşmüyorlar. Bölgede kimse yok, WhatsApp'tan yazıyor; o da sanırım robot, otomatik cevap veriyor. Ne yazdığını anlamadan üç kere aynı cevabı veriyor. Sonra da 'istemiyorsanız çalışmayın' diyebiliyorlar.";True;komisyon
27528509;Yemeksepeti Restoran Sahiplerine Destek Sağlamayan Online Sipariş Platformu;10 Ocak 2024 15:51;8.644;;Yemeksepeti Restoran sahibiyim. Kendi işletmemi annemin adından kendi adıma devir aldım. Bunun için yemek sepetine başvuru yaptım. Restoranı yeniden açacaklarını ancak kurye olarak kendi kuryelerini yollayacaklarını söylediler. Tamam diyerek kabul ettim. Ancak bulunduğum bölge de asla Yemeksepeti Kuryesi yok. 1 ayda bir tane sipariş geldi. Bunun için Yemeksepeti ile hem arama hem mail hem mesaj her türlü irtibatı kurmama rağmen hala yardımcı olmadılar. Kendi kuryem ile çalışarak daha çok satış yapmak istiyorum. Ancak kendi komisyon çıkarını düşünen Yemeksepeti yetkilileri yardımcı olmamayı tercih ediyorlar.;True;komisyon
27527306;Yemeksepeti Canlı Destek Mağduriyetleri;10 Ocak 2024 14:26;1.516;;10 yıllık üyenizim. Dünyanın en kötü canlı destek hattına sahipsiniz, bazı çalışanlarınızın işten çıkarılması gerektiğini düşünüyorum. Yardımcı olmak için çaba göstermiyorlar, üstelik bizi oyalayıp engel oluyorlar ve sorunlarımızı çözmek yerine başlarından savıyorlar. Kendimi değersiz hissetmekten çok sıkıldım. Siz bu canlı desteği ve hizmet kalitenizi düzeltmediğiniz sürece ya rakip firmanın uygulamasını kullanmayı düşünüyorum ya da komisyon ödememek için restoranları doğrudan arayarak sipariş vereceğim.;True;komisyon
27416728;Yemeksepeti Rezil Firmalar Kotu Ürün Gönderiyor, Zehirleniyoruz;30 Aralık 2023 23:29;1.333;;"Her önüne gelenle çalışıp kalitesiz ürünler sunuluyor. Her şey para ve alınan komisyon mu? İnsan sağlığı hiç önemsenmiyor mu? Balık siparişi verdim, sağlığım bozuldu; tatlı siparişi verdim, istediğim kalmamış, yerine başka bir tatlı göndermişler. İşin garip yanı, balık siparişi verdiğim yerin bir balıkçı, tatlı siparişi verdiğim yerin bir tatlıcı olması. Ne tesadüf ki, her iki yer de aynı. Kalitenize uygun firmalar dışında, diğer firmaların sizin adınızı kullanarak tanınmalarına izin vermeyin. Size olan güvenimiz zedelendi.";True;komisyon
27390696;Yemeksepeti Onayımı Almadan Kendi Kuryesine Geçti;28 Aralık 2023 14:34;13.383;1.0;Restoran olarak Yemek Sepeti Express komisyon ücreti ve açılış-kapanış saatlerini sormak için başvuru yaptım. Beni arayıp bilgileri aktarmadan ve onayımı almadan Express'e geçiş yapmışlar. Kendi kuryem dükkanımızda beklerken, gelen siparişi 1 saat sonra Yemek Sepeti kuryesi gelip alıyor. Gece 3'e kadar açık olmamıza rağmen Yemek Sepeti akşam 9'da sistemi kapatıyor ve bu yüzden birçok müşteri kaybettim. Bir an önce sistemden çıkış yapmak istiyorum ancak sürekli olarak erteleniyor.;True;komisyon
27394846;Yemeksepeti Yetkili İle Çözüm Bekliyorum;28 Aralık 2023 20:09;1.900;1.0;"İşletmemizi büyütürken maalesef Yemek Sepeti destek olacağı yerde bize engel oldu ve bizi zorla kendi kuryeleri ile çalışmaya itti. 14 gün boyunca komisyon oranını %10'dan %29'a çıkartarak ve keyfi olarak bölgelerin çoğunu kapatarak bizi mağdur ettiler. 5 gündür defalarca arayıp geri dönüş talep etmemize rağmen kimse dönüş yapmıyor. Sözde bölge sorumlusu H**** C** var; ancak ona ya ulaşamıyoruz ya da sürekli toplantıda olduğunu söylüyor ve geri dönüş yapmıyor. Yemek Sepeti hattına bağlandığımızda ise karşımıza hiçbir yetkili çıkmıyor ve çözüm sunulmuyor.";True;komisyon
27382699;Yemeksepeti'nde Restoran Açılış Süreci;27 Aralık 2023 21:14;3.623;;Yemeksepeti'ne restoran açtırma çilesi... 2 iş günü yazan başvuru incelenme süreci asla 2 değil. Haftalar sürüyor ve asla çözülmüyor. Restoran hizmetlerine defalarca mail atıp telefonla aramamıza rağmen sonuçlanmıyor. Komisyon almasını çok iyi bilen bu uygulama hem müşteriler üstünden geçinen hem de restoranları mağdur eden bir uygulama... Zincir restoranlara yapamadıkları bu eziyetleri esnaf restoranları ezerek tatmin etmeye çalışıyorlar.;True;komisyon
27347365;Burger King Ve Yemek Sepeti;24 Aralık 2023 21:55;946;;"Burger King, Kuzey Kıbrıs Türk Cumhuriyeti'nde Yemek Sepeti'ne verdiği etkinlik izni nedeniyle Yemek Sepeti üzerinden Burger King'den sipariş verdim. 2,5 saattir sipariş 'hazırlanıyor' diyor ve hiçbir şekilde Kuzey Kıbrıs Türk Cumhuriyeti'nde Burger King'in ulaşım iletişim adresi olarak telefon numaraları bulunmuyor. Yemek Sepeti'nin de iletişim numarası mevcut değil. İki şirket de müşteri memnuniyeti konusunda yetersiz ve Kuzey Kıbrıs Türk Cumhuriyeti'nden kesinlikle sipariş verilmemeli; yoksa zor duruma düşebiliyorsunuz. Burger King de, Yemek Sepeti de sipariş verilecek şirketler arasında olmamalı. Yemek Sepeti'nden sipariş vererek zaten lokantalardaki menü fiyatlarının biraz daha üstünde ödeme yapıyorsunuz, maksat Yemek Sepeti'ne komisyon kazandırmak. İş bu duruma gelince, üzerine bir de sipariş işlemini düzgün yapamıyorlar.";True;komisyon
27345743;Yemeksepeti Bu İşi Bilmiyor;24 Aralık 2023 18:29;1.304;;Yemek Sepeti platformunda müşterilerime kendi kuryelerimle hizmet verirken, bir gün şahsi telefonumdan Yemek Sepeti çalışanı a** bey tarafından arandım. Bana %20 komisyon oranı ile Yemek Sepeti kuryesini denememi önerdi. 20 gün içinde memnun kalmazsam eski sistemime geri dönebileceğimi belirtti. Bu teklif üzerine Yemek Sepeti kuryelerine geçiş yaptım. Çünkü daha avantajlı olacağım söylendi. Ancak 20 gün sonunda memnun kalmayıp kendi kuryeme geri dönmek istediğimde bunu yapamadım ve Yemek Sepeti kuryesiyle çalışmaya başladım. 15 gün içinde işlerim altüst oldu. A**bey'e tekrar ulaşmaya çalıştığımda ise cevap alamadım. 4 aydır a** bey'le iletişim kuramıyoruz ve bir muhatap bulamıyoruz. Şikayetim bu konudan ibarettir. Anadolu gurme 0543****2;True;komisyon
27336469;Yemek Sepeti Pişmanlıkları;23 Aralık 2023 16:55;2.280;1.0;Yemek sepetinde satıcıyım 5-6 ay oldu işletmeyi devraldım yemek sepetinde iki farklı isimde şubemiz var birinin devri ilk ay yapıldı ancak diğer şubemizin devri hâlâ yapılmadı 5-6 aydır iki günde bir arıyorum talebimi oluşturuyorlar dönüş yapılacağı söyleniyor ancak hiç kimse dönüş yapmıyor... Satmış olduğumuz ürünlerin parası devir aldığım adamın hesabına yatıyor. 3 haftadan beri de o işletmeye giriş yapılamıyor. Ne kadar para yatıyor ne kadar komisyon kesiliyor beni kimse bilgilendirmiyor belki de dükkanı bana satan adam göndermesi gereken paradan daha azını bana yolluyordur... Diğer bir şikayetim de ben dükkanı açtığından beri kendi kuryeme geçmek istiyorum iki günde bir arıyorum talep oluşturup aciliyet belirtiyorlar ancak bunda da dönüş yapan kimse yok. Diğer şikayetim yemek sepetinin Gaziantep sorumlusu H**** H******. Güya bu adam bizim sorunlarımızı çözmek için var. Sorun olmaktan başka bir işe yaramıyor. Kendisini defalarca aradım onlarca kez mesaj attım hiç birine dönüş yapmadı sadece iki sefer mesajıma dönüş yaptı onda da yıllık izindeyim yazmış... Yemek Sepeti sattığımız ürünlerde kendi komisyonunu kuruşuna kadar alıyor ve sonrasında asla sizin hiçbir sorununuzla ilgilenmiyor...;True;komisyon
27327673;Yemeksepeti Üye İş Yeri;23 Aralık 2023 12:01;2.724;;Yemeksepeti üye iş yeri restoran ortaklığı. Yemek Sepeti ile çalışmaya başladım. Restoranımın kuryesi olmadığı için y. S üstlendi ve 1 ay dolmadan kendi kuryem ile çalışmak istediğimi belirttim ve 20 gün beni oyaladılar. Artık kendi kuryem ile çalışmayacaksam sizin kuryenize sipariş vermeyeceğim diye belirttim fakat inatla sistemden paket atıp kendi kuryelerini yönlendiriyorlar. Müşteri hizmetleri aradığında durumu bildirip kendi kuryem ile çalışmak istediğimi söyleyince de telefonu yüzme kapatıyorlar. Hiçbir şekilde muhatap bulamıyorum. Sözleşmede %40 'lik bir komisyon kestiklerini belirtip totale bakıldığında %60 civarı komisyon kesiyorlar bu yasaya aykırı bir durumdur. Bugün sabahta arayıp kendi kuryeniz ile çalışamazsınız bizim kuryemiz ile çalışmak zorundasınız gibi ithamlarda bulundular. Konuşmaları kaydettiklerini söylüyorlar zaten kayıtlarda da mevcuttur, Yemeksepeti ile çalışıp kendi kendi kuryesi ile çalışan bir sürü tanıdığım restoran var bize gelince mi olmuyor. Bu konu burada bitmeyecek yemek sepetinin sorumsuz yetkililerine sesimi buradan duyurmak istiyorum. Bu konu dava ile sonuçlanacak. Şimdi Umarım bu yazıyı görürsünüz sizinle anlaşmak yerine dava edip adaletin cevabını bekleyeceğim adalet bu konuyu çözmezse de kendim gelip bizzat sorunu çözeceğim.;True;komisyon
27312386;Yemeksepeti Kestiği Paranın Hesabını Vermiyor.;21 Aralık 2023 20:18;1.192;1.0;Yemeksepeti üzerinden v49a kodlu Gastronot sokak lezzetleri isimli restoranımın 11 Aralık tarihli ödemesinin bana gönderilen komisyon ve kazanç bilgileriyle hesapladığımda yatması gereken tutardan 1000 TL eksik yattığını gördüm. Bunun üzerine müşteri hizmetleri restoran destek hattıyla iletişim e geçip durumu anlattım. Şikayetimi oluşturup geri dönüş beklememi istediler. 10 gün içerisinde 4-5 kere daha şikayette bulunmama rağmen hala geri dönüş yapılmadı. Ticari ortaklık yaptığımız bir markanın paramı neden kestiğinin hesabını vermek için bir gayretinin olmaması bu markaya olan güvenimi sarsmış bulunmaktadır. Marka işini ve partnerlerini ciddiye aldığını göstermesi için yazdığım bu şikayeti umarım ivedilikte cevaplar ve kendilerine, yarattıkları sorunu çözmesi için verdiğim bu fırsatı değerlendirir.;True;komisyon
27310031;Yemek Sepeti İnsanlardan %38 Komisyon Alıyor Ama Hakkını Vermiyorlar.;21 Aralık 2023 13:55;1.168;1.0;"Ben hayatımda bugüne kadar bu kadar kalitesiz hizmet, kalitesiz çalışma görmedim. 2 gündür işletmemiz aktif çalışmakta. Yemek Sepeti, oluşturduğumuz menüleri kendileri değiştirerek isim koyuyor. Bunun yanı sıra menülerimizi karışık hale getirmişler. Aradığımızda durmadan yetkili talebinde bulunuyoruz; sözde hep bize dönüş yapılacağı söyleniyor, fakat ne dönüş yapan var ne de sorunlarımızı çözen. 'Mail üzerinden ulaşın' dediler. Mail attık, bizi 2 gündür oyalıyorlar. Açılışta sipariş yağarken şu anda ne sipariş geliyor ne bir şey. Müşterilerimiz arayarak menülerimizde ürünleri göremediklerini dile getiriyorlar. Ama Yemek Sepeti'nin ne kadar umurunda ki? Çalışma ve iş ortaklarına önem vermiyorlar. %38 komisyonla çalışan bir firmaya göre çok yetersiz bir işletim sistemi mevcut.";True;komisyon
27301163;Yemek Sepeti Fiyatları;20 Aralık 2023 20:39;615;;Yemek Sepeti'ndeki Little Caesars'tan 2 adet pizza aldım. Yemek Sepeti'ne ödediğim fiyat 390 TL. Pizza kutusunun üzerinde 'gel al' fiyatı olarak 70 TL yazıyor. Bu kadar fiyat farkı olur mu? İki adet için 140 TL ödeyebilirken, 390 TL ödedim ve üstelik sadece iki arka sokaktan geliyor. Yemek Sepeti, siz hiç mi fiyat kontrolü yapmıyorsunuz? Tamam, oturduğunuz yerden yemeğiniz geliyor ama bu kadar fark eder mi? Yazık, gerçekten.;True;komisyon
27300592;Yemeksepeti Kurye Hizmetleri Ve Müşteri Temsilcisi Sorunu;20 Aralık 2023 19:56;2.515;;Yemek Sepeti kuryesi ile çalışmaktayız. Yüksek komisyon ödemekteyiz ve hizmetten hiç memnun kalmadık. Kendi kuryemize geçiş yapmak istiyoruz ancak bu talebimize cevap verilmiyor. Yemek Sepeti'nde yetkili biriyle iletişim e geçmeye çalıştığımızda, ev işleriyle meşgul olduklarını belirterek bizimle sağlıklı bir iletişim kurulamıyor.;True;komisyon
27297131;Restoran Sayfa Açılışı İçin Yemek Sepeti Zorla Hizmet Kullandırımı;20 Aralık 2023 15:20;1.755;1.0;Restoranımızın Yemek Sepeti'nde satış yapmasını istediğimiz için başvuruda bulunduğumuzda, kendi kuryemiz olmasına rağmen sadece vale hizmeti ile çalışmamız halinde sayfa açabileceğimiz belirtildi. Biz siparişlerimizi kendi kuryelerimizle göndermek istiyoruz, %40 komisyon ödeyerek vale hizmeti kullanmak istemiyoruz.;True;komisyon
27220008;Yemek Sepeti Sipariş Gelmedi Ulaşamıyoruz;13 Aralık 2023 20:18;443;;"Yemeksepeti'nden sipariş verdim. 25-40 dakika denilen restoran 1 saati aşkın süredir gelmedi ve canlı destek le bağlantı kurulamıyor. İptal de edilemiyor. Bu durum çok sinir bozucu, bir daha Yemeksepeti'ni kullanmayacağım. Ayıptır, günahtır; o kadar komisyon alıyorsunuz.";True;komisyon
27218690;Ödeme Konusu Yemeksepeti Şikayetim Var;13 Aralık 2023 18:22;1.600;;"Yemeksepeti'nde restoran işletmekteyim; ancak ödemeler konusunda hiçbir şekilde memnun değiliz. Online ödemem 30 bin TL iken hesabıma yatan tutar 13 bin TL. 17 bin TL kesinti olamaz; bu, olması imkansız bir durum. Kaç defa Yemeksepeti muhasebe ile görüşmeme rağmen herhangi bir çözüm üretilmedi. Yemeksepeti çalışanı bile komisyon ücretini bilmiyor. Ben artık bir çözüm istiyorum.";True;komisyon
27197988;Yemeksepeti Ödeme Problemi Ve İletişimsizlik!;12 Aralık 2023 03:34;1.406;;... Ltd. Şti Şirket sahibiyim. Gıda sektöründe faaliyet gösteriyorum ve Yemeksepeti Restorant uygulamasın ile Yemeksepeti'ne %40 komisyon vererek çalışıyorum. 28.10.2023 tarihinde hesabıma para yatırılmaması sebebi ile kendilerine önce telefon ile ulaşmaya çalıştım. Telefon ile bir yanıt alamayınca mail yoluyla durumu anlattım. Yemeksepeti çalışanlarının bana göndermiş olduğu mail de borcum olduğu için ödeme gerçekleştirilmemiştir denildi. Yemeksepeti üzerinden gerçekleştirdiğim satışların ekstre, döküm ve faturalarını Yemeksepeti'nden talep etmeme rağmen açıklayıcı bir cevap alamıyorum. 01.12.2023 tarihinden beridir telefonla bana dönüş yapmalarını talep ediyorum fakat hiçbir şekilde geri dönüş sağlanmıyor. Firmanın kendi oluşturmuş olduğu ve sadece kendilerinin anlayacağı dilde olan excel dosyasını göndererek buradan borcunuzu öğrenebilirsiniz denildi. Mali müşavirim dosyayı inceledi fakat kendisi de borcun kaynağını bulamadı. Sürekli olarak sorduğumuz sorulara aynı dosyaları göndererek aynı cevapları vermektedirler. Telefonla bilgi vermedikleri gibi yerinde çözüm için randevu talebimizi de cevapsız bırakmaktadırlar. Şundan çok eminim ki benim mailleri mi okuyup şunu söylüyorlardır. Bırakın biraz daha uğraşsın! Biz yaptık oldu şeklinde çalışma sistemi ile kaç kişi mağdur ediliyordur acaba? İlginç olan bir durum ise telefonla muhasebe departmanına bağlıyorlar fakat telefonu açan çalışanlar, burası muhasebe departmanı değil diyerek talebinizi oluşturalım diyerek bizleri günlerce bekleyeceğimiz ve hiçbir zaman net cevap alamayacağımız bir sürecin içerisine sürüklüyorlar. İçinde olduğum durumu elimden geldiğince anlatmaya çalıştım. Umarım sorularımın cevabını herkesin anlayabileceği bir dilde verebilirler.;True;komisyon
27196320;Yemeksepeti'ne Paramızı Ödemiyor, Bize Dönüş Yapmıyor;11 Aralık 2023 23:02;189;;Yemek Sepeti ile ekim pizza olarak aktif çalışmaktayız. Firmamıza yatırılmış olan ödeneğini ciddi miktar da eksik olduğunu belirtmek adına sürekli arama yaptık, ayrıca mail olarak bilirdik fakat yetkili bir muhatap bulamadık. Sadece şikayetimizi kaydedip geri dönüş yapılmıyor. Lütfen bu konu da bize gerekli dönüşler yapılsın. Yemek Sepeti gibi bir firmanın bu kadar sorumsuz ve duyarsız olması çok üzücü. Gerekli ve ivedi bilgi istiyoruz lütfen. Acil dönüş lütfen;True;komisyon
27157927;Yemeksepeti Zorla Kendi Kuryesi İle Panel Açmak;08 Aralık 2023 14:00;861;;Yemek Sepeti'nde satış yapmak için platform açmak istiyorum ancak Yemek Sepeti, 'Zorunlu olarak kendi kuryemizi kullanacaksınız, aksi takdirde satış yapamazsınız.' şeklinde dayatmada bulunuyor. Yetkili kişilerin bu duruma bir an önce müdahale etmesini istiyorum. Bünyemizde mevcut olan 3 adet kuryemiz varken, neden Yemek Sepeti'nin kuryesini kullanmak zorunda kalmalıyım, anlam veremiyorum. Zorla fazla komisyon almak için bizi zorladıklarını düşünüyorum. Bu konuda yetkili kişilerden yardım bekliyorum.;True;komisyon
27082715;Yemeksepeti Sözleşme Değişikliği Sorunu;02 Aralık 2023 12:37;834;1.0;Yemeksepeti platformunda restoranım var. Kendi kuryemizle teslimat yaparken, güzel bir komisyon iskontosu ile tarafımıza 14 günlük kendi kuryelerini kullanabileceğimiz 'Express Teslimatlı' sisteme geçip yeni sözleşme imzaladık. 14 gün geçmeden sistemden ayrılmak istediğimizi çünkü sürekli teslimat ve ödeme tipi şikayetinden dolayı belirtmemize rağmen, artık eski sözleşmeleri üretemediklerini ve bizim 'Express Teslimat' harici yeni sözleşme yapamayacağımızı söylüyorlar. Komisyon indirimi adı altında yeni sözleşme tarafımıza imzalatarak aldatıldık. Lütfen bu problemimi çözebilecek bir yetkili ulaşsın. Standart bilgisayar cevaplarınızı istemiyorum.;True;komisyon
27019812;Yemek Sepeti Çalışma Koşulu;27 Kasım 2023 22:13;3.513;1.0;Merhaba, Biz, Fethiye'de bir restaurant işletmesidir. İşletmemiz 3,5 yıldır faaliyet gösteren bir yerdir. Sadece 3 ay önce vergi mükellef değişikliği yapıldı. Fakat ne ünvan değişikliği ne de çalışan değişikliği yaptık, aynı şekilde devam ediyoruz. Vergi kaydı değiştiğinden Yemek Sepeti bize Yemeksepeti verilerimizin sıfırlanacağını söyledi. Ve yeni işletme muamelesi yaptı. Getir ® ve Trendyol ®'da da varız onların böyle bir talebi olmadı çünkü bu tamamen mantık dışı bir eylem. Restaurant paket hizmeti de verdiğinden 1 ay bizi bekletip kendi kuryeniz ile çalışma mecburiyeti koşup ancak 1 ayın sonunda açtı ve bunu açarken de kendi kuryeleri ile çalışmanın sadece 1 aylık bir deneme olduğunu sonrasında kendi kuryenize geçebilirsiniz denildi. 1ay dolduktan sonra kendi kuryemize geçmek için yaklaşık 12-13 kayıt oluşturduk. Her defasında konu ilgili departmanlara iletildiğini, dönüş yapılacağı iletildi. Fakat 13 kaydın hiçbirine dönüş alamadık. İş yeri bütünü ile aynıdır personeli, çalışma konusu, menüsü hiçbir değişiklik içermemektedir. Sadece vergi mükellefi değişmiştir. Yemek sepetinin kuryesi ile çalışmaya geçtikten sonra birçok sorun yaşıyoruz. Birincisi bölgemizde km sınırları var. Ölüdeniz, kayaköy, hisarönü, Ovacık gibi ciddi yüklü siparişlerin geldiği bölgeye hizmet vermiyorlar. Ayrıca siparişleri geç düşmekte, yoğunlukta veya gece geç saatte kurye sayıları nedenini bilmediğimiz bir durumdan dolayı siparişlere çok geç gelmekte veya gelmemekte, bu da müşterinin siparişinin soğumasına, veya iptaline neden olmaktadır. İptallerde yemek bedelinin iadesini alamıyoruz, müşteri memnuniyetsizliği oluşuyor, müşteri kaybına neden oluyor. Çünkü müşteri bu gecikmenin nedeni olarak restaurantı tanıyor. Hem ürün çöp oluyor, hem işletme olarak bunun zararını sizden alamıyoruz hem de müşteri kaybına neden oluyor. KDV si ile birlikte neredeyse %38 leri bulan komisyon kesintisine rağmen kurye hizmetini sağlayamıyorlar. Bizlere de kendi kuryemizi kullanmamıza izin verilmiyor. Madem bizden bu oranları alıp sözleşmenizde yer verdiğiniz kurye hizmetini sunmak istiyorsunuz, fakat görülüyor ki sözleşmenize uymuyorsunuz. Biz ısrarla yineliyoruz. İşletmemiz kendi kuryesini kullanmak istemektedir. Bu mağduriyetimizin bir önce düzeltilmesini istiyor. Yemek Sepeti'nden çözüm ve dönüş bekliyoruz. Saygılarımızla.;True;komisyon
26981918;Yemeksepeti İşletmemize Vermiş Olduğu Zarar;24 Kasım 2023 16:41;563;1.0;Yemeksepeti bütün emeklerimi hiçe sayıyor. Yemeksepeti çalışanı beni aradı ve Yemek Sepeti kuryesi ile çalışmak ister misiniz 15 günlük bir kampanya var %32 komisyon yerine %20 komisyon ile 15 gün çalışabilirsiniz ondan sonra %32 ile devam edecektir istediğiniz zaman da bırakabilirsiniz dediler ama 20 gündür talep oluşturuyorum kendi kuryemle çalışmak istiyorum diyorum ama geçemiyorum geri dönüş yapmıyorlar. Müşteri kaybediyorum ve işletmemin adı lekeleniyor. Lütfen geri dönüş yaparak sorunumu çözünüz.;True;komisyon
26981241;Yemeksepeti Yemek Siparişinde Kurye Sorunu;24 Kasım 2023 15:50;449;1.0;Yemek Sepeti müşterisiyim. Yaklaşık 1 yıldır kurye hizmetini Yemek Sepeti'nden alıyorum. Ancak geldiğim noktada yüzde kırka varan verdiğim komisyonlardan dolayı kendi kurye hizmetimi kendim yapmak istedim. Ancak yaklaşık bir buçuk aydır her gün aramama rağmen hiçbir dönüş alamıyorum. Zorla komisyon alıyorlar ben de.;True;komisyon
26953205;Yemeksepeti Çağrı Merkezi Sayfa Kapatma Tehdidi;22 Kasım 2023 13:07;820;1.0;Yemeksepeti restoran üye iş yeri sahibiyim. Yemeksepeti çağrı merkezi çalışanı, müşteri talebi üzerine bir ürünün çıkarmamızı istedi. Biz de sistemden düşün göndermeyelim, böylece o ürün için komisyon ödemeyelim dedik. Ancak sistemden çıkaramadıklarını söylediler. Ben de neden çıkarayım dediğimde, müşteri memnuniyeti için gibi bağırılarak bir cevap aldım. Müşteri memnuniyeti için neden size komisyon ödeyeyim, bana ne hakla bağırıyorsunuz dediğimde, sayfanız kapatılırsa görürsünüz gibi tehdit cümlesi kurulup yüzüme telefon kapatıldı. Bu hakkı kim, nasıl veriyor çok merak ediyoruz.;True;komisyon
26910886;Pizzanın Sucukları Yanmıştı Yemeksepeti Kabul Etmiyor;18 Kasım 2023 19:11;7.405;1.0;Yemeksepeti Pizza Hut pizza siparişi verdim. Zaten Pizza Hut 55 dakikada soğuk pizzayı getirdi bekledik soğukta olsa yeriz dedik ancak sucuklu pizzanın üzerindeki sucuklar yanmıştı. Yemeksepeti destek chate bağlandım. Diyor ki pizzayı muhafaza ettiniz mi sucuklar yanıktı sucukları attık yedik. 1 saat beklemişiz 1 pizza için 1 saat daha bekleyemezdik. Pizza Hut kalitesini çok bozmuş ama ödemeyi Yemeksepeti'ne yaptım ücret iadesi istiyorum. Yemeksepeti firmaların üstünden komisyon alıyorsa ben ödemeyi Yemeksepeti'ne yaptığım için ödememi geri yapacak olan Yemeksepeti. Ben yeni pizza istemiyorum;True;komisyon
26889709;Yemek Sepeti İlgisiz;16 Kasım 2023 21:45;9.065;1.0;"2 ay önce Yemek Sepeti platformuna ortak oldum. Keşke olmasaydım. Kendi kuryeleriyle çalışmaya zorluyorlar. 'Benim kendi motorum, kendi kuryem var' diyorum ama ilgilenmiyorlar. Kimse aramıyor, her gün e-posta gönderiyoruz, her gün müşteri hizmetleri ni arıyoruz, 'yetkililere ilettik' diyorlar ama bir tane yetkili aramıyor. Komisyon ücreti çok yüksek; restoranın aldığı kadar, hatta daha fazla ücret alınıyor. Bölgeler çok kısıtlı, lütfen ilgilenin Yemek Sepeti yetkilisi.";True;komisyon
26866665;Yemeksepeti Kurye Sürekli Iban İstemesi;15 Kasım 2023 08:47;1.266;;"10 Kasım 2023 tarihinde akşam üzeri Yemeksepeti'nden sipariş verdim. Daha önce de her gelen kurye 'Sistemimizde hata var, IBAN'a yollasanız olur mu?' diyordu ve bu durumu düzelteceklerini düşünerek Yemeksepeti'ne bildirdim. Ancak hiçbir düzeltme yapılmamış ki, 10 Kasım'daki siparişimde de kurye 'Sistemimizde hata var, IBAN'a yollasanız olur mu?' dedi. Artık sinirlendim, ne gibi bir işleyiş bu anlamıyorum. Kredi kartı komisyonunu mu kendilerine alıyorlar ya da Yemeksepeti'ne daha az komisyon mu ödüyorlar, bilmiyorum. Üstelik siparişim de iptal edildi. Akşam yemeğini eşim ve çocuğumla yemeyi planlıyordum; bu duruma mı üzüleyim, yoksa her seferinde yaşanan bu sorunlara mı? Eğer bu gibi uygunsuz durumları kabul ediyorsam, zaten restoranın kendisinden sipariş verirdim. Lütfen bu durum incelensin ve önceki gibi göz ardı edilmesin. Neden tanımadığım kişilere kişisel bilgilerimi vermek zorunda kalıyorum? Hem restorandan hem kuryeden hem de en önemlisi Yemeksepeti'nden bir açıklama bekliyorum.";True;komisyon
