id;title;date;view_count;rating;content;is_full_content;category
34632242;Kendi Kuryemle Çalışma Talebime Uzun Süredir Yanıt Alamıyorum;22 Aralık 19:14;89;;"Uzun süredir Yemeksepeti’nde kayıtlı olan restoranım Payidar bir'Lahmacun için, yaklaşık 8 Aralık’tan bu yana kendi kuryemle çalışmak istediğimi defalarca iletmeme rağmen hiçbir şekilde dönüş alamıyorum. Talebimi açıkça belirtmiş olmama rağmen, süreçle ilgili bana net bir bilgi verilmiyor. Telefon ve e-posta yoluyla sayısız kez müşteri hizmetleri yle görüştüm. Her seferinde sadece “kayıt oluşturduk” denilerek geçiştiriliyorum; ne bir açıklama yapılıyor ne de geri dönüş sağlanıyor. Bu belirsizlik hem iş planlamamı zorlaştırıyor hem de kendi kuryemle çalışamadığım için yüksek komisyon yüküyle karşı karşıya kalıyorum. Artık bu konuyla ilgili tarafıma net ve yazılı bir geri dönüş yapılmasını, restoranım Payidar bir'Lahmacun’un kendi kuryesiyle çalışması için gerekli tanımlamaların acilen yapılmasını talep ediyorum.";True;komisyon
34637732;Yemeksepeti'nde Şablon Mesajlarla Oyalayan Ve Sorumluluk Almayan Hizmet Anlayışı;23 Aralık 11:00;156;1.0;"Yemeksepeti'nin Şablon Mesajları ve Müşteri Aklıyla Alay Eden Hizmet Anlayışı Bu şikayeti sadece dün yaşadığım tek bir olay üzerine değil, uzun süredir gözlemlediğim ve artık kronikleşen bir ""hizmet verememe"" sorunu üzerine yazıyorum. Dün akşam saatlerinde verdiğim yemek siparişi, uygulama üzerinde neredeyse bir saat boyunca ""Hazırlanıyor"" ve ardından ""Yolda"" statüsünde göründü. Süre çok uzayınca restoranla bizzat iletişim e geçtim şunu öğrendim: Sipariş restorana hiç düşmemişti. Yemeksepeti'nin sistemi yüzünden 1 saat boyunca gelmeyecek bir yemeği bekledim. Uygulama ise muhtemelen süre dolduğu için otomatik olarak ""Siparişiniz yolda"" yalanını söylüyordu. Müşteri temsilcisine bağlandığımda ise yine aynı senaryo yaşandı. Temsilci, restoranla görüşüp siparişin iletilmediğini teyit etti ve iptal işlemi yaptı. Buradaki asıl sorun siparişin teknik bir hatayla iletilmemesi değil; her sistemde hata olabilir. Asıl sorun, Yemeksepeti’nin kriz anında takındığı tavırdır. 1. Robotlaşmış İletişim: Karşımızda bir muhatap yok. ""Sizin sisteminiz yüzünden mağdur oldum, sorumlusu kim? "" diye sorduğumda, sadece kopyala-yapıştır şablon mesajlarla (geri bildiriminiz önemli, kayıt aldık vb.) geçiştirildim. 2. Müşteriyi Hafife Alma: Eskiden Yemeksepeti denince ""insan"" odaklı, samimi bir çözüm merkezi akla gelirdi. Yemek Sepeti müşteri hizmetleriyle konuşurken bir insan ile konuştuğumuzu hissederdik. Hatta bu konuşmalardan bazıları sosyal medyada yer edinmiş, şirketin samimiyetinin bir göstergesi olarak çok güzel bir tanıtım aracına dönüşmüştü. Şimdi ise kurumsallaşma adı altında müşteriyi sadece oyalayan, aklıyla alay eden bir yapı var. 3. Sorumluluk Reddi: Geçmişte de eksik sipariş sorunlarında ""yasal uyarı"" yapar gibi konuşmaların paylaşılmasını yasaklayan tehditvari bir üslupla karşılaşmıştım. Firma, restoran ile müşteri arasında köprü kurup komisyon alırken var; ancak sorun çıktığında hiçbir sorumluluk almıyor. Özetle; risk almadan, sorumluluk üstlenmeden ve müşteriyi ""şablon mesajlarla"" oyalayarak yürütülen bu operasyonu kabul etmiyorum. Ufak tefek aksaklıkları telafi edecek bir jest veya samimi bir özür bile sunamayan bu yapı, müşteri memnuniyetinden tamamen uzaklaşmıştır. Sonuç olarak: Artık Yemeksepeti'ni sadece bir ""telefon rehberi"" olarak kullanacağım. Restoranı bulup, doğrudan kendilerini arayarak sipariş vereceğim. En azından bir sorun olduğunda karşımda gerçek bir muhatap bulabiliyorum ve komisyon emekçinin cebine kalıyor.";True;komisyon
34655733;Kendi Kuryemi Kullanmak İstediğimde Yemeksepeti Geri Dönüş Yapmadı;24 Aralık 21:48;-;;İstanbul Beylikdüzü’nde hizmet veren Smashcraft Burger adlı restoranım için Yemeksepeti üzerinden yaklaşık 6 aydan uzun süredir ciddi bir mağduriyet yaşıyorum. Restoranım ilk açıldığında kendi kuryemiz olmadığı için Yemeksepeti kuryesini kullanmak zorunda kaldık. O dönem temsilciler, ileride kendi kuryemizi kullanmak istersek talep açmamızın yeterli olacağını, hemen değişiklik yapılacağını ve bunun hiçbir sorun olmayacağını özellikle belirttiler. Kendi kuryemizi oluşturmamızın ardından, yüksek komisyon maliyetleri nedeniyle Yemeksepeti kuryesini iptal edip teslimatları tamamen kendi kuryemizle yapmak istediğimizi defalarca ilettik. Uygulama üzerinden en az 6–7 defa kayıt açmama rağmen ne arayan oldu ne de tarafıma herhangi bir geri dönüş yapıldı. Bu durum, hem işletmem açısından ciddi bir malı yük oluşturuyor hem de bize, Yemeksepeti kuryesini kullanma konusunda adeta zorunlu bir dayatma yapılıyormuş hissi veriyor. Yemeksepeti’nden, daha önce söz verildiği şekilde restoranım için Yemeksepeti kuryesinin derhal iptal edilmesini ve teslimatları tamamen kendi kuryemle yapabileceğim şekilde hesabımın güncellenmesini talep ediyorum. Uzun süredir geri dönüş yapılmayan bu mağduriyetimin acilen giderilmesini rica ediyorum.;True;komisyon
34528424;Yemeksepeti Express'ten Çıkışta Karşılaştığımız Zorluklar Ve Yüksek Komisyon Sorunu;12 Aralık 02:27;364;1.0;Oburger Kayseri şubesi olarak yaklaşık 5 yıldır Yemeksepeti’nde faaliyetteyiz. Uzun süre boyunca kendi kuryemizle teslimat yapıp yüzde 10 komisyon ödeyerek sorunsuz bir şekilde çalışıyorduk. Geçtiğimiz yıl deneme amaçlı olarak Yemeksepeti Express taşımacılığına geçtik ve siparişleri Yemeksepeti’nin kendi kuryelerinin götürmesini kabul ettik. Ancak, keşke bu değişikliği yapmasaydık diyorum. Şu anda Yemeksepeti Express sisteminden çıkmak istiyorum fakat adeta zorla bu hizmette tutuluyorum. Yüzde 40’lara varan komisyon oranlarıyla çalışmak zorunda bırakılıyorum. Kendi isteğimle girdiğim bir hizmetten yine kendi isteğimle çıkmak istiyorum. Buna rağmen, “Çıkamazsınız, biz taşıyacağız, bu komisyonu almak zorundayız” şeklinde cevaplar alıyorum. Bir hizmete zorla tabi tutulmak ve kendi kuryemi kullanmak isterken buna engel olunması, ticari ve etik açıdan kabul edilebilir bir durum değil. Yaklaşık 1 aydır süren bu yeni süreçte bana, sistemden çıkabilmem için bir ay beklemem gerektiği, bu bir ay içinde gelen siparişlerin belirli bir oranını iptal etmem gerektiği, ayrıca kendi kurye kaynaklı iptallerimin de yüzde 4 seviyesinde olması gerektiği söylendi. Yani özetle, daha fazla sipariş iptali yaparsam belki bir ay sonra sistemden çıkarılabileceğim ifade edildi. İş ortağı olduğumuz bir platformun, kendi ayaklarımızla satın aldığımız bir hizmeti bu şekilde bir baskı aracına dönüştürmesini ve bizi sanki bir esir kampındaymışız gibi hissettirmesini asla doğru bulmuyoruz. Biz sadece restoranımız için en uygun kurye yöntemini seçmek ve aşırı yüksek komisyon oranları olmadan, sürdürülebilir bir çalışma düzeni kurmak istiyoruz. Yemeksepeti Express taşımacılığından kendi isteğimizle, hiçbir şart ve yaptırım olmadan çıkmak ve tekrar kendi kuryemizle teslimat yaparak makul komisyon oranlarıyla çalışmak istiyoruz. Bu süreçte yaşadığımız zorlamanın ve iptal dayatmalarının sonlandırılmasını, iş ortaklığına yakışır şekilde çözüm üretilmesini talep ediyorum. Aksi halde mecburen restoranımızı platformdan kapatmak durumunda kalacağız ve bu yaşadığımız süreci de müşterilerimize açıklamak zorunda kalacağız.;True;komisyon
34533530;Yemeksepeti'nde Kendi Kuryeme Geçişte Haksız Şartlar Ve Mağduriyet;12 Aralık 16:16;257;;Yaklaşık iki haftadır Yemeksepeti uygulamasında kendi kuryemi kullanmak istiyorum ancak bu konuda ciddi şekilde mağdur ediliyorum. Bir restoran işletmecisi olarak, kendi kuryemi kullanmak istediğimi belirttiğimde bir ay daha aynı yüksek komisyon oranıyla devam etmem ve bu süreçte iptal edilen sipariş oranımın yüzde otuzun üzerine çıkması yönünde şart koşuldu. Bu süreçte hem ciddi müşteri kaybı yaşayacağım hem de işe aldığım kurye için bir ay boyunca boşa ödeme yapmak zorunda kalacağım. Sisteme ilk dahil olurken kendi kuryeme geçişin hızlı ve kolay bir şekilde yapılabileceği söylenmişti. Ancak gelinen noktada, adeta 'girmek var, çıkmak yok' anlayışıyla hareket edildiğini görüyorum ve bu durum işleyişimi olumsuz etkiliyor. Başından beri beklentim, kendi kuryemi kullanarak komisyon oranımın yüzde 38 yerine yaklaşık yüzde 12 seviyesine düşürülmesi ve bu geçişin makul, adil ve hızlı bir şekilde sağlanmasıydı. Müşteri hizmetleri yle yaptığım görüşmelerde bu şartlar konusunda ısrarcı davranılıyor ve herhangi bir esneklik ya da çözüm odaklı yaklaşım gösterilmiyor. Kendi kuryemi kullanarak devam edebilmem, komisyon oranımın düşürülmesi ve bu süreçte müşteri kaybı ile kurye maliyetiyle mağdur edilmememin sağlanmasını talep ediyorum.;True;komisyon
34522686;Ücretsiz Denilen Reklam İçin Yüksek Kesinti Ve Eksik Ödeme Mağduriyeti;11 Aralık 16:55;226;1.0;Yemeksepeti restoran panelimizi 25 Kasım’da açtık. Açılışa özel olarak bize “ilk ay ücretsiz, size reklam tanımladık” denilerek CPM/CPC adı altında bir reklam açıldı. Ancak bu reklamdan sadece 6 sipariş gelmesine rağmen, toplamda 100 sipariş aldık ve buna rağmen tarafımıza yapılan ödemede çok ciddi kesintilerle karşılaştık. Toplam satış ciromuz 40.000 TL’nin üzerindeyken, hesabımıza yatan tutar sadece 12.000 TL oldu. Yani yaklaşık %70’e varan bir kesinti yapıldı. Bunun üzerine bir de “ücretsiz” denilen reklam için 5.000 TL tutarında ek kesinti uygulanmış. Ücretsiz denilen bir reklamın faturadan bu şekilde düşülmesi, hesabını bilmeyen işletmeleri yanıltmaya yönelik bir sistem gibi görünüyor ve bu şartlarda kâr etmek neredeyse imkansız hale geliyor. Aydella Büyükçekmece şubesi için, restoran ID: i52n üzerinden bu işlemler yapıldı. Müşteri temsilcisiyle görüştüğümde, tutarın yanlış olduğunu kabul ediyor ve “Haklısınız, kayıt açtım” demekten başka bir aksiyon alınmıyor. E-posta atıyorum, geri dönüş yapılmıyor, yetkili biriyle görüşmek istediğimde de hiçbir şekilde görüştürülmüyorum. %70’e yakın komisyon kesiminin üzerine bir de “promosyon” ve “ücretsiz reklam” adı altında ekstra tutarlar alınması, işletme açısından kabul edilebilir bir durum değil. Bu nedenle, hesaplarımızda haksız ve fazla kesilen tüm tutarların, özellikle ücretsiz denilen 5.000 TL’lik reklam ücreti de dahil olmak üzere, en kısa sürede tarafımıza iade edilmesini ve bu konuda yazılı ve net bir açıklama yapılmasını talep ediyorum.;True;komisyon
34414653;Kapanan Restoranım İçin Bilgilendirme Yapılmadan Haksız İcra Takibi Başlatıldı;01 Aralık 22:16;331;;"Yaklaşık bir yıl önce işlettiğim “Adıyaman Çiğ Köfte S**** U***” isimli restoranımı kapatmama rağmen, Yemeksepeti tarafından iki gün önce 26.011,72 TL tutarında bir icra dosyasıyla karşılaştım. Herhangi bir borç bildirimi, aranma ya da SMS/mail yoluyla bilgilendirme yapılmadan, kendi aralarında belirledikleri komisyon ve reklam ücreti adı altında doğrudan icraya verilmişim. Restoranı kapattıktan sonra tarafıma hiçbir şekilde borçla ilgili bir bilgi gelmedi; ne arayan oldu ne de yazılı bir uyarı aldım. Durumu fark eder etmez Yemeksepeti ile iletişim e geçtim, müşteri hizmetleri ni aradım ancak sadece “aranacaksınız” denilip oyalanıyorum ve kimse geri dönüş yapmıyor. Aynı zamanda firmamı kapattıktan sonra Komagene bayiliği ile çalışmaya devam ettim ve komisyon ile reklam giderleri Komagene firmam üzerinden ödenerek carime eksi bakiye olarak yansıtıldı. Buna ek olarak, işletmem 01.06.2025 tarihinde resmi olarak kapatıldığı için bu tarihten sonra vergilendirme yapılmaması gerekirken, mağazam kapalı olmasına rağmen 28.10.2025 tarihine kadar hâlâ borç yazılmaya devam edilmiştir. Herhangi bir bilgilendirme yapılmadan, kapalı bir işletme üzerinden bu şekilde icra işlemi başlatılmasını haksız ve kabul edilemez buluyorum. Ankara Mamak’ta açılan bu icra dosyasının derhal incelenmesini, haksız yere çıkarılan bu borcun iptal edilmesini ve icra dosyasının tamamen kapatılmasını talep ediyorum.";True;komisyon
34375385;Kendi Kuryemi Kullanamıyorum Mağduriyetim Giderilmiyor;27 Kasım 23:10;375;1.0;"İstanbul Pendik Batı Mahallesi’nde işletmekte olduğum restoranım için Yemeksepeti’nde kendi kuryeme geçmek istiyorum; ancak yaklaşık iki aydır, Ekim ayından bu yana bu talebimle ilgili olarak sürekli oyalanıyorum. Bu süreçte defalarca, yaklaşık yüz kez aramama rağmen tarafıma hiçbir şekilde geri dönüş yapılmadı ve herhangi bir işlem başlatılmadı. Bu süre içinde kendi kuryemi işe aldım ve artık siparişlerin paketlemesini ve teslimatını kendim yönetmek, paketleri kendim göndermek istiyorum. Buna rağmen sistemde kendi kuryeme geçişim yapılmadığı için hâlâ Yemeksepeti kuryelerini kullanmak zorunda kalıyorum ve yüksek komisyon oranları nedeniyle işletmem ciddi anlamda zarar görüyor. Kendi kuryemle teslimata geçiş talebimin acilen işleme alınmasını, konu hakkında net ve yazılı bir bilgilendirme yapılmasını ve bu kadar uzun süre geri dönüş yapılmamasından kaynaklanan mağduriyetimin giderilmesini istiyorum.";True;komisyon
34390190;Joker Kampanyası Nedeniyle Aşırı Komisyon Kesintileri Ve Maddi Zarar;29 Kasım 13:51;448;;İşletmemi Yemeksepeti üzerinden Joker kampanyasına dahil ettim. Ancak kampanyaya girdiğim andan itibaren “Joker bedeli” ve “Joker KDV bedeli” adı altında iki kez ve çok yüksek oranlarda komisyon kesildiğini fark ettim. Zaten kâr etmeyen bir işletmeyken bu kesintiler nedeniyle ciddi anlamda zarara uğramaya başladım. Örneğin 800 TL’lik bir siparişte, kesilen komisyon ve Joker bedelleri sonrası bana sadece 346,55 TL ödeme yapılıyor. Yani ödeme eksik yatmıyor, ancak haddinden fazla kesinti yapıldığı için sipariş başına ciddi zarar ediyorum. Bu durumda satış yaptıkça zarar eder hale geldim. Yaklaşık 2 gündür Joker kampanyasındayım ve bu zararı gördüğüm için kampanyadan çıkmak istedim. Müşteri temsilcisiyle görüştüğümde talebimin değerlendirileceği söyleniyor ancak işletmem Joker’den çıkarılmıyor ve kesintiler aynı şekilde devam ediyor. Bu durum işletmeme ciddi maddi zarar veriyor. İşletmemin derhal Joker kampanyasından çıkarılmasını ve kesilen komisyon, Joker ve KDV bedellerinin oranlarının açık ve şeffaf bir şekilde tarafıma yazılı olarak açıklanmasını talep ediyorum. Ayrıca bu aşırı kesintiler nedeniyle oluşan zararımın da incelenip tarafıma iade edilmesini istiyorum.;True;komisyon
34247295;Kendi Kuryeme Geçiş Talebime Yemeksepeti'nden Yanıt Alamıyorum, İşlerim Aksıyor;16 Kasım 02:11;652;;Yemeksepeti iş ortağı olarak Ankara Aktepe’de hizmet veren Zirve Soğuk Baklava işletmecisiyim. Yaklaşık 2 aydır kendi kuryeme geçiş yapmak istiyorum. Komisyon oranlarının yüksek olması nedeniyle kendi kuryemle çalışarak bu oranı düşürmek ve fiyatlarımı müşterilerim için daha uygun hale getirmek istiyorum. Bu süreçte defalarca telefonla aradım ve e-posta gönderdim (p*******@partners.yemeksepeti.com), ancak tarafıma hiçbir şekilde geri dönüş yapılmadı. Sistemsel bir sorun nedeniyle kendi kuryeme geçişim onaylanmıyor ve bu durum işleyişimi olumsuz etkiliyor. Yemeksepeti’nden beklentim, kendi kuryeme geçiş talebimin hızlıca değerlendirilip onaylanması ve tarafıma dönüş yapılmasıdır. Sorunumun acilen çözülmesini rica ediyorum.;True;komisyon
34231822;Kendi Kuryemizle Çalışma Talebimize Dönüş Yapılmıyor Ve Sorunumuz Çözülmüyor;14 Kasım 13:53;712;;Tosthane Didim (Didim/Aydın) işletmesinin sahibi olarak, Yemeksepeti üzerinden uzun süredir yaşadığımız bir sorunu paylaşmak istiyorum. Yüksek komisyon oranları nedeniyle kendi kuryemizle çalışmak için defalarca başvuruda bulunduk. Ancak her seferinde “kısa sürede dönüş yapacağız” denilerek süreç sürekli erteleniyor ve herhangi bir net çözüm sunulmuyor. Bu durum yaklaşık birkaç aydır devam etmektedir. Restoranımıza ait mağaza ID’si: z248’dir. Bizim beklentimiz, kendi kuryemize geçiş hakkının bir an önce tanınması ve bu konuda net bir geri dönüş yapılmasıdır. Sorunumuzun acilen çözülmesini talep ediyoruz.;True;komisyon
34127767;Yemeksepeti Joker Kesintisiyle Haksız Kazanç Ve Destek Eksikliği;03 Kasım 19:59;1.276;;"Restoran sahibiyim. Yemeksepeti’nde Joker indirimi hiçbir şekilde aktif olmamasına rağmen, her siparişimden 'Joker kesintisi' adı altında haksız para alıyorlar. Müşteri hizmetleri ni defalarca aradım; 'Joker aktif görünmüyor ama kesinti var, işlem yapamıyoruz' diyerek geçiştiriyorlar. Bu tamamen işletmecilerin emeğini yok saymak ve haksız kazanç elde etmek demektir. Yemeksepeti, destek hattıyla da çözüm üretmeyerek mağduriyetimizi büyütüyor. Bu platformdan satış yaptığım için pişmanım. 31.11.2025 itibariyle kapatıyorum. Restoran ıd: v* 0 538 041 **.";True;komisyon
34124368;Kendi Kuryemizi Kullanmamıza İzin Verilmiyor, Mağduriyet Yaşıyoruz;03 Kasım 14:53;995;;Haziran 2025’ten bu yana, restoran kodumuz gjsn ile Yemeksepeti üzerinden kendi kuryemizi kullanmak için en az 5 defa yazılı olarak ve çok sayıda telefon görüşmesiyle başvuruda bulunduk. Ancak her hafta e-posta yoluyla yaptığımız başvurular dikkate alınmadı, tarafımıza yalnızca “Müşteri yorumlarından dolayı puanınız 4.0 altına düşerse ya da iptal siparişleriniz artarsa talebiniz değerlendirmeye alınır” şeklinde bir geri dönüş yapıldı. Bunun dışında herhangi bir yazılı veya resmi yanıt alamadık. Şu anda Yemeksepeti’nin kendi kuryesini kullanmak zorunda kalıyoruz. Bu durum, öncelikle uzun yıllardır istihdam ettiğimiz kuryemizi işten çıkarmamıza neden oldu. Ayrıca, kötü hava koşullarında paketlerimizin teslimatı gecikiyor ve ürünlerimiz müşterilere sıcak ve zamanında ulaşmıyor. Komisyon oranlarının yüksekliği nedeniyle de ciddi maddi kayıplar yaşıyoruz. Bizimle yapılan sözleşmede sadece Yemeksepeti kuryesiyle çalışacağımıza dair bir madde bulunmuyor ve yaklaşık 10 yıldır kendi kuryemizi sorunsuz şekilde kullanıyorduk. Nisan ayında bir kez Yemeksepeti kuryesine geçiş yaptık ve o tarihten beri kendi kuryemizi tekrar kullanmamıza izin verilmiyor. Talebimiz, mevcut anlaşmamız kapsamında kendi kuryemizi kullanmamıza acil olarak izin verilmesi ve bu süreçte yaşadığımız mağduriyetin giderilmesidir. Restoranımız İstanbul Beylikdüzü Beykent’te hizmet vermektedir.;True;komisyon
34103415;Yemeksepeti'nden Haksız Sipariş İletim Bedeli Kesintisi Nedeniyle Maddi Zarar;31 Ekim 19:56;1.428;;"Sakarya'da faaliyet gösteren ""Çorbam"" adlı restoranımda, yaklaşık 10 gündür Yemeksepeti iş ortağı olarak hizmet vermekteyim. Restoranımı açtığımdan bu yana toplamda 30 sipariş aldım. İlk 20 siparişte herhangi bir sorun yaşanmazken, son 10 siparişte her bir siparişten ""sipariş iletim bedeli"" adı altında ek bir kesinti yapılmaya başlandı. Satış fiyatı arttıkça, bu kesintinin de orantılı olarak yükseldiğini ve bu durumun işletmemi maddi olarak zarara uğrattığını fark ettim. Konu hakkında Yemeksepeti müşteri hizmetleriyle iletişime geçtim, ancak böyle bir uygulamanın olmadığını belirttiler. Oysa elimde, yapılan kesintileri gösteren belgeler mevcuttur. Son 10 siparişte toplamda yaklaşık 2.500 TL zarara uğradım. Bu mağduriyetimin giderilmesini, yapılan kesintilerin iadesini ve bundan sonra da sipariş iletim bedeli adı altında herhangi bir kesinti yapılmamasını talep ediyorum.";True;komisyon
33868736;Yemeksepeti'nin Ek Ücret Ve Komisyon Politikaları İşletmemizi Mağdur Ediyor;06 Ekim 12:32;3.025;5.0;Lüleburgaz Büfe Komşu olarak Yemeksepeti'nin son dönemde uyguladığı ücretlendirme politikası nedeniyle ciddi mağduriyet yaşamaktayız. Sipariş veren müşterilerden teslimat ücretine ek olarak “hizmet bedeli” adı altında alınan ek ücretler, müşterilerimizde olumsuz bir algı oluşturmakta ve bu ücretlerin işletmemiz tarafından alındığı düşünülmektedir. Bu nedenle müşterilerimiz sık sık bizi arayarak tepki göstermekte, işletmemiz haksız yere suçlanmaktadır. Ayrıca Yemeksepeti’nin uyguladığı yüksek komisyon oranları ve ek ücretler nedeniyle toplamda %40’Lara varan kesintiler yapılmakta, bu da işletmemizin sürdürülebilirliğini olumsuz etkilemektedir. Tüm bu ücretlendirme politikaları, özellikle ülkenin ekonomik olarak zor bir dönemden geçtiği bu günlerde, esnafı daha da zor durumda bırakmaktadır. Müşterilerden alınan ekstra ücretler ise ticari etik açısından da rahatsızlık vericidir. Bu konuyla ilgili olarak Yemeksepeti müşteri hizmetleriyle iletişime geçmemize rağmen herhangi bir muhatap bulamadık ve sorunumuz çözülmedi. İşletme no: b1a5 Yemeksepeti’nden beklentimiz, mevcut ücretlendirme politikasını yeniden gözden geçirmesi ve hem işletmelerin hem de müşterilerin mağduriyetini giderecek şekilde düzenleme yapmasıdır.;True;komisyon
33807831;Yemeksepeti Yüksek Komisyon Ve Kurye Zorunluluğu Mağduriyeti;29 Eylül 15:59;2.202;1.0;Yemeksepeti üzerinden Eskişehir’de faaliyet gösteren restoranım için yaklaşık 3 aydır ciddi bir sorun yaşıyorum. Platform, kendi kuryeleriyle çalışmam için beni zorlamakta ve bu nedenle yüksek komisyon talep etmektedir. Restoranımın üye numarası: zmgx. Bu konuyla ilgili olarak defalarca Yemeksepeti ile iletişim e geçmeme rağmen hiçbir şekilde geri dönüş alamadım ve mağduriyetim devam ediyor. Her siparişte aynı sorunla karşılaşıyorum. Kendi kuryemle çalışabilme hakkımın tanınmasını ve bu mağduriyetimin giderilmesini talep ediyorum.;True;komisyon
33863528;Yemeksepeti Joker Yanıltmacası!;06 Ekim 08:53;1.683;;;False;komisyon
33775725;Yemeksepeti Vale'den Ayrılamıyoruz: Yüksek Komisyon Ve Cevapsızlık;25 Eylül 17:42;2.534;1.0;"Ayvalık Tost Dünyası Aydın Efeler Cumhuriyet Caddesi şubesi olarak, Yemeksepeti Vale kurye sistemine yaklaşık bir yıldan uzun süredir dahiliz. İşletme numaramız D 531’dir. Başlangıçta cazip görünen komisyon oranları zamanla ciddi şekilde arttı; yüzde 20 ile başlayan oranlar şu an yüzde 44’e ulaştı. Sattığımız ürünlerin neredeyse yüzde 40’ı Yemeksepeti’ne komisyon olarak gitmekte ve bu durum işletmemizi ciddi anlamda zarara uğratıyor. Bu yüksek komisyon oranları nedeniyle sistemden ayrılmak istediğimde ise, tarafımıza herhangi bir yazılı açıklama veya sözleşme sunulmadan, sadece “kural setleri” olduğu ve bu kuralları ihlal etmediğimiz sürece sistemden çıkamayacağımız belirtildi. Yaklaşık bir yıldır hem e-posta hem de telefon yoluyla defalarca başvurmama rağmen, tarafıma sadece “anlıyorum” şeklinde yanıtlar verildi; herhangi bir çözüm ya da resmi açıklama iletilmedi. Yemeksepeti Vale kurye sisteminden özgürce ayrılma hakkımın tanınmasını ve bu konuda net bir açıklama yapılmasını talep ediyorum.";True;komisyon
33775626;Yemeksepeti Yemek Kartı Ve Kendi Kurye Kullanımına İzin Vermiyor;25 Eylül 17:28;2.417;1.0;İstanbul Bayrampaşa’da faaliyet gösteren Gwzy jr. Tosting ve Sandviç olarak, Yemeksepeti Partner platformunda yaşadığımız bir sorunu paylaşmak istiyorum. Lokasyonumuzun çevresindeki diğer restoranlar yemek kartı ile ödeme kabul edebiliyor ve kendi kuryeleriyle çalışabiliyorlar. Ancak aynı talebimizi Yemeksepeti’ne ilettiğimizde herhangi bir gerekçe sunulmadan olumsuz yanıt alıyoruz. Bu durum, restoranlar arasında haksız rekabete yol açıyor ve aynı müşteri kitlesine ulaşmamızı engelliyor. Sistemimiz açıldığından beri bu sorun devam ediyor. Hem müşteri hizmetleri yle görüşmeler yaptık hem de mail yoluyla destek talebinde bulunduk fakat hiçbir şekilde olumlu bir dönüş alamadık. Ayrıca kendi kuryemizle çalışmamıza izin verilmediği için yüksek komisyon oranları ödemek zorunda kalıyoruz. Talebimiz, restoranımızın da yemek kartı ile ödeme kabul edebilmesi ve kendi kuryemizle çalışabilmemiz yönündedir. Bu konuda mağduriyetimizin giderilmesini ve diğer restoranlarla eşit şartlarda hizmet verebilmemizi rica ediyorum.;True;komisyon
33739686;Yüksek Komisyon Oranları İşletmeleri Zorluyor;22 Eylül 09:14;2.282;;Yemeksepeti'nde mağaza açacağım ama komisyon oranları ciddi derecede yüksek benden daha fazla para kazanıyor. Hesap yaptığımda bu kadar ciddi komisyon oranı alınır mı? Sadece Yemeksepeti'nde değil getir, Migros ve Trendyol'da da böyle! İşletmelere yazık değil mi?;True;komisyon
