id;title;date;view_count;rating;content;is_full_content;category
30969016;Yemeksepeti'nde Komisyon Oranı Karmaşası Ve Müşteri Hizmetleri Sorunu;12 Aralık 2024 18:16;5.908;;1 kuruş para kazanmayayım, bir problemim olduğunda müşteri hizmetleri asla bana destek olmasın diyorsanız Yemeksepeti ile çalışabilirsiniz. Bu kadar düşük kaliteli bir şirket yok. Üşenmeden detaylı detaylı anlatacağım. Lütfen okuyun ve sizler de mağduriyet yaşamayın. 2 ay önce kar-zarar oranlarımızda dengesizlik olduğunu görünce çalıştığımız bütün online yemek platformlarını aradık. Hepsine komisyon oranlarımızı sorduk tek tek. Yemeksepeti de bize KDV dahil %37 olduğunu söyledi. 1 ay önce ay sonu kar-zarar oranlarımızda tekrar bir dengesizlik görünce çok detaylı bir inceleme başlattık. Ayın her gününü tek tek hesapladık ve komisyon oranını düşünce bize yatırılan paranın çok komik bir para olduğu ortaya çıktı. Hemen Yemeksepeti'ni aradık. İlk aradığınızda siparişler için 1'e basın muhasebe için 2'ye basın dediler ve muhasebe birimine bağlandık. Bağlanır bağlanmaz şikayetimizi anlattık. İlk konuştuğumuz kişi sesinizi alamıyorum deyip telefonu kapattı. Tekrar aradık 2. Kişi de sesiniz gelmiyor dedi kapattı. İnanır mısınız 3. Kere aradık ve yine sesinizi alamıyorum deyip kapattılar. Sinirlenip başka bir birime bağlandık ve konuşmasına fırsat vermeden sorunumuzu anlatıp komisyon oranımızı sorduk ve bize KDV dahil %42 olduğunu söyledi. Sanırım ''müşterilere yalan söyleyin'' tembihini yapmayı unuttuğunuz bir çalışanınızdı. Hani %37'ydi dediğimizde bir bilgisinin olmadığını söyledi. Ama işin komik tarafı hesapladığımız tutar %42 bile değildi. %70 gibi bir kesinti var ortada. Onların dediği gibi %42'yse eğer bize yatırmaları gereken çok para var ama hesabımıza yatan bir para yok. Telefondaki kişiye işletmemizi kapatmak istediğimizi söyledik. Mail atmamız gerektiğini söyledi. Klasik kaçamak cevapları zaten. Ne yaşarsanız yaşayın mail atın diyorlar. Neyse biz mailimizi de attık. Komisyon oranımızı düşürmelerini istediğimizi, düşürmüyorlarsa da kalan paramızı hemen bize yatırıp işletmemizi kapatmalarını istediğimizi yazdık. Bugün bu mailin üzerinden tam 15 gün geçti. Ne bir mail geldi ne de telefonla arayan var. Bu düpedüz iş bilmemezliktir. İşletmelere komisyon oranı konusunda çok profesyonel bir şekilde yalan söylüyorsunuz. Ay sonu her işletme kar-zararını hesaplar. Ve yüklü bir miktarda açık çıkarsa maalesef ki önce çalışanlar hesaba çekilir. Siz bu elemanların da hakkına giriyorsunuz. Siz bu ekonomide zar zor geçinmeye çalışan esnafın da hakkına giriyorsunuz. Bu konunun peşini bırakacağımızı düşünmeyin. Bütün hukuki haklarımızı kullanacağız.;True;komisyon
30863617;Kurye Komisyonlarındaki Ani Artış Ve Çıkış Sorunu;03 Aralık 2024 18:29;2.351;1.0;Sisteme giriş yaparken kurye komisyonları %20 oluyor 3 ay sonra %37 oluyor. Bu nasıl sistemdir. Kurye sisteminden çıkış yapmak istiyorum çıkartmıyorlar. Yemeksepeti almış başını gidiyor ne bir iletişim kurabiliyoruz ne başka bir şey. Kurye sisteminizden çıkmak istiyorum. Bu sisteminize mecbur değilim.;True;komisyon
30792903;Yemek Sepeti'nin Joker Uygulaması Esnafı Zor Durumda Bırakıyor;27 Kasım 2024 01:43;4.148;1.0;Yemek sepetinin Joker uygulamasından hiçbir türlü çıkılmıyor. Müşteri hizmetleri ni arıyoruz, mail atın diyorlar. Mail atıyoruz uygulamadan değiştirin diyorlar. Uygulamadan değiştirmeye çalışıyoruz. Sistem hata veriyor değişmiyor. Müşteri kazanıyor. Yemek Sepeti kazanıyor. Esnaf zarar ediyor. Ve bunu bile isteye yapıyor Yemek Sepeti. Yemek Sepeti tarafından hiçbir türlüde aksiyon alınmıyor. Kendileri daha fazla komisyon alabilmek için esnafı zararı uğratıyorlar.;True;komisyon
30891994;Yemeksepeti Partner Başvurumun Kayıp Ve İlgisizliği;05 Aralık 2024 23:34;3.596;;Yemeksepeti partner başvurumu 26 ekimde yaptım. 1.5 ay oldu İnternet üzerindeki başvurumu kaybettiler. Tekrar başvuru yaptım 19 kasımda o günden beri de dönüş olmadı sürekli arıyorum sürekli mail gönderiyorum ama umursamıyorlar. Gerçekten yıldım artık. Bölge sorumlusu arayacak dediler. Hak getire aramadılar. Başvuru sonrası giriş yapman gerekiyordu dediler. Buna dair bilgilendirme mesaj mail hiçbir şey gönderilmedi. Bunu söylediğimde de şaşırıyorlar. Müşteri temsilcileri talebinizi aldık. Demekten başka bir şey yapmıyor yetkililere bağlayamıyorlar ben hayatımda gerçek anlamda bu kadar kötü ve sorumsuz bir firma görmedim. Trendyol GO 2 gün içerisinde başvurumu onaylayıp panelimi açtı ama Yemeksepeti partner müşterilerine değer vermiyor umursamıyor. Komisyon almaya gelince çok güzel alıyorlar ama. Gerçekten artık sabrım tükendi bunlardan sonra da bana geri dönüş olmaz ise şikayet edebileceğim her yere şikayet edeceğim. Gerekirse haber kanallarına sosyal medyaya vereceğim.;True;komisyon
30758357;Yemeksepeti'nin Yüksek Komisyonları İşletmemizi Zorluyor;23 Kasım 2024 19:54;3.185;;Çiğköfte dükkanı işletmemizde Yemeksepeti ile çalışmaktayız. Joker kampanyasına katıldık. Joker'de hem 150 TL kupon kesip üstüne de 120 TL kendine komisyon alan Yemeksepeti'ni bu hareketi için kınıyorum. Neredeyse yüzde 200'e yakın komisyon alıyor. Kazançlarımız düştü.;True;komisyon
30736008;Yemek Sepeti İle İş Birliğinde Güven Sorunları;21 Kasım 2024 17:58;3.152;1.0;Yemek Sepeti restoran anlaşmam var. Son dönemde yaşadığım olumsuzluklar nedeniyle Yemek Sepeti ile çalışmak istemediğimi bildirdim. Hâlâ kapanış talebim ile ilgili geri dönüş bekliyorum. Aslında olumsuzluk demek yetersiz kalır. Yemek Sepeti sipariş takibinden, indirimlerinden, komisyon oranlarına ve tahmini kazanç kısmına kadar şaibelerle dolu ve kesinlikle güven vermiyor. Yetkili birimlerden dönüş bekliyorum diye defalarca aradım mail atın dediler. Mail attım sonuçlanan tek bir problemim yok. Resmen restoranı mağdur etmek üzerine kurulmuş. Sistem;True;komisyon
30733743;Yemeksepeti Joker İndirimi: Gizli Ücretler Ve Destek Eksikliği!;21 Kasım 2024 15:11;5.663;1.0;Restoran olarak Yemeksepeti Joker indirimine katıldık. Ancak Joker indirimine katılırken çok önemli olmasına rağmen hiçbir şekilde belirtilmeyen Joker Bedeli diye bir şeyle karşılaştık. Zaten restoran olarak tüm Joker indirimlerini karşılamamıza ve Yemeksepeti'nin %38lik komisyonuna rağmen ek olarak Joker bedeli diye bir ücret daha aldığını gördük. Jokerden çıkmak istedik ancak 1 haftadan uzun sürdü. Zararına çalıştık ancak platformdan yeterli desteği alamadık. Diğer online yemek platformlarında böyle bir durumla karşılaşmadık.;True;komisyon
30700205;Yemeksepeti'nin Kendi Kuryemizi Kullanma Talebimizi Reddetmesi;18 Kasım 2024 16:53;3.524;1.0;"6 Şubat depremlerinde Adıyaman'da ev ve iş yeri yıkılan bir aileyiz. Depremden sonra Kayseri'ye taşındık ve elimizdeki son imkanlarla küçük bir çiğköfteci dükkanı açtık. Yemeksepeti, T**, M** Y** vb. Online platformlar üzerinden belli bir komisyon karşılığında satış yapmaya başladık. Online platformlar üzerinden tanıtım amaçlı zararına dahi olsa satış yaptık. Yaklaşık 3-4 ay geçtikten sonra bu platformların komisyon oranının kar bırakmamasından dolayı kendi kuryemizi istihdam etmeye başladık. T**, M** Y** ve G** firmaları birkaç gün içerisinde bu talebimizi yerine getirerek kendi kuryemiz ile paket servisi yapmamıza imkan tanıdılar. Yemeksepeti firması bu talebimizi yerine getirmedi. Yemeksepeti firması onlarca başvurumuza ve hakkımız olmasına rağmen bu talebimizi yerine getirmemiştir. Firmadan ne bir yetkiliye (bölge sorumlusu vb.) ulaşabiliyoruz ne de talebimizi yerine getirdiler. Bütün iletişim kanallarından talebimizi iletmemize rağmen, ""Talebinizi aldık, en kısa sürede size geri dönüş yapılacak vs. Vs."" cümlelerinden başka bir şey duymadık. Kendi kuryemize geçiş ile ilgili talebinizi mantıklı bir gerekçe sunmadan red edildiğini bize bildirdiler. Yakınımızda bulunan birçok işletme Yemeksepeti platformu üzerinden kendi kuryesi ile paket servisi yapabiliyorken bizim kendi kuryemize geçiş işlemi 4 aydan fazla bir süredir yerine getirilmiyor. Son 20 gündür panelimiz kapalı ve restoranımız satışa kapalı olmasına rağmen tek bir kişi bile arayıp yardımcı olmuyor.";True;komisyon
30638031;Joker Kampanyasında Haksız Kesinti;12 Kasım 2024 19:45;4.037;1.0;Yemek Sepeti kullanıcısıyım. Joker kampanyasına katılıyorum. Joker indirimi dışında çok kazanıyoruz ya, Yemek Sepeti de Joker bedeli kesiyor. Bu vicdansızlıktır! Hem jokerden 150 TL düşüyoruz, bir de Yemek Sepeti 125 TL kesiyor ve bedavaya çiğ köfte dürüm gönderiyoruz müşteriye. Bizim yanımızda olması gerekirken bir de neymiş, Joker bedeli kesiyor. Zaten kestiğin kadar komisyon kesiyorsun, bir de cumartesi arayıp Joker iptal edin diyorum. Bugün Salı olmuş, hala iptal edecekler. İptal ederler mi? Bir de müşteri temsilcisi, 'konunun aciliyetini belirttim' diyor ama sallayan yok.;True;komisyon
30559513;Yemeksepeti İle İş Birliği Kabusa Dönüştü!;04 Kasım 2024 23:12;5.320;1.0;Ben iki restoran sahibi bir işletmeciyim. Bundan 2.5 sene önce Yemeksepeti beni arayıp bizim kurye sistemimiz var kullanmak ister misiniz diye sordular. Özellikle memnun kalmaz iseniz istediğiniz zaman iptal edebilirsiniz diye de belirttiler. Ben yaklaşık 2.5 senedir bu sistemi kullanmaktayım ancak son 8 aydır o kadar kötü bir sistemleri var ki yağmur yağar, kurye 1 saatte gelmez ve müşteri beni arar, kavga ederiz. Yemeksepeti'ne ulaşmak mümkün değil ama olur da ulaşırsanız verdikleri cevaplar biz manuel kurye atayamıyoruz, sistem atıyor deniyor. Müşteri de ben ekstra 21 lira getirme ücreti ödüyorum ama 1 saatte geliyor diyor. Yemeksepeti kuryesi yüzünden o kadar çok müşteri kaybettim ki haddi hesabı yok. Ayrıca ilk işe başladığımızda %23 ile başlarken şimdi komisyon ücreti %32 + 18 KDV almaktadır. Yani restorana ortak oldular. 2 aydır sistemlerinden çıkmak istediğimi belirtmeme rağmen beni çıkarmıyorlar. Bir ara insaflı birine denk geldim ve bana yeni %10'luk bir sözleşme gönderdiler. Bu sözleşme mail inin 2 günlük süresi olduğunu bilmiyordum ve iş yoğunluğundan süreyi geçtiğim için link süresi geçti diye sözleşmeyi de imzalayamıyorum. Yaklaşık 2 haftadır defalarca kayıt bırakmama rağmen ne geri dönüş oldu ne de beni aradılar. Son kez mail atıp aradım, eğer dönüş olmaz ise haftaya hukuki süreç başlatacağımı ayrıca hem işletmeme zarar vermekten hem de maddi sıkıntıya düşürdükleri için tazminat davası açacağımı belirttim. Kendi kuryemi işe alacağım, çocuk iş bekliyor dememe rağmen ilgilenmediler. Ek olarak ekran resimlerini de paylaşıyorum. Dava açtığımda da dilekçemi sosyal medya ve buradan paylaşacağım. Siz ülkenin bu zor zamanlarında bizlere destek olmak varken bizim restoranlarımıza ortak oluyorsunuz. Yazıklar olsun. Bu yaptıklarınız yüzünden zamanı geldiğinde kimse sizinle çalışmayacak emin olun...;True;komisyon
30540758;Yüksek Komisyon Ve Kötü Hizmetle Mücadele;02 Kasım 2024 19:24;6.976;1.0;"2 defa kayıt açtırdım, restoran kuryeme geri dönmek istiyorum diye ancak beni yeni aldıkları işletmelerle karıştırdılar sanırım. 2 defa arandım, durumu anlatınca 'hı hı hı o zaman ben gerekli bölüme durumu ileteceğim' deyip görüşme sonlandırıldı. Aranacağım söylendi, hiçbirinde aranmadım. Ben yaklaşık 2.5 - 3 sene restoran getirsin olarak hizmet verdim. Daha sonra bölge sorumlunuz H**** C** Bey geldi. Vale şöyle böyle anlattı. Tamam dedik geçtik, başlarda iyiydi ancak daha sonra avantaj değil dezavantaja döndü. Çok yüksek komisyon ödeyip kötü hizmet alıyoruz. Bu nedenle de tekrar restoran kuryesine geri dönmek istiyorum. Tekrar söyleyeyim, ben evde üretim yapan Yemeksepeti restoranı değilim. Ben Yemeksepeti üyesi olurken 2019'da mutfak fotoğrafı, tabela görünecek şekilde dış cephe fotoğrafı gerekli evraklarla binbir zorlukla üye yapıldım, 1 ay sürdü onaylanmam. Yani beni tehdit edemezsiniz, kurallar falan diyemezsiniz. Onları evde ya da üretim yaptığı belli olmayan işletmelere yapın. Sorunlar çok fazla; 1) Ben kapıda yemek kartlarını aktif etmek istiyorum. Bunun için de kendi kuryem olmak zorunda. 2) 10 dakika bekler, söylenmeye başlar, başınızda rahatsız edecek şekilde bekler. 3) 2-3 sipariş arka arkaya gelse hemen sistemi bana sormadan yoğunluğa alıyorsunuz, bazen 1 saat yoğunlukta bırakıp maddi kayıp yaşıyorum. 4) Müşteri kapıda nakit seçip sonra kartla ödemek istediğinde paket bana geri geliyor. Ödeme alınamadı olarak. 5) Müşteri yanlış adres veriyor. Online ödeme yapmış, ürünü adres yanlışmış deyip ürünü bana geri getiriyorsunuz, ücret yine yok. 6) Sistemde kuryeniz az olduğunda 1 saatte giden siparişlerim oldu ve iptaller yaşandı. Hepsi işletme olarak bana yansıtıldı. Taşın altına el konulmadı. 7) Toplamda %42 komisyonluk hizmet almıyorum. 8) Kuryeleriniz kafasına göre çalışıyor. Yağmur yağdı, sisteme girmez; hava çok sıcak olur, sisteme girmez. Özetle ben siparişlerimi rahat rahat hazırlayarak daha az komisyonla yemek kartları aktif şekilde kendi kuryelerimle teslim etmek istiyorum. Vale bana müşteri kaybettiriyor, diğer platformlarda Yemek Sepeti'nin en az 3 katı iş yapıyorum. Rekabet kurumunun şartlarına lütfen uyun.";True;komisyon
30539357;Yemek Sepeti Komisyon Kesintileri;02 Kasım 2024 16:19;3.999;1.0;Yemek Sepeti kullanıcısıyım. Yaptığım satışlarda Joker açıyorum, yanında ayrıca bir sürü kesinti oluyor. Böyle bir şey olur mu? Bu kadar kesinti kul hakkı, yazık günah. 755 TL satıştan kalan 238 TL bana kalıyor. Ekmeği, tavuğu, yeşilliği bedavaya Yemek Sepeti'ne çalışıyoruz...;True;komisyon
30538681;Yemeksepeti Dört Gündür Jokeri İptal Etmek İstememe Rağmen Hala İptal Etmiyorlar;02 Kasım 2024 15:00;3.182;1.0;Yemek Sepeti'ne üye işyeriyim. Hesabımı incelediğimde, restoranın sahibi ben değilmişim, Yemek Sepeti'ymiş gibi görünüyor. Böyle bir komisyon oranı başka hiçbir yerde yok. Dört gündür jokeri iptal etmek istememe rağmen hala iptal etmiyorlar. Bu durum bana zarar veriyor. Böyle kalitesiz ve mağduriyet yaşatan bir işletme görmedim. Kurye tahsil ettiği için zarar ediyorum.;True;komisyon
30464967;Yemeksepeti'nde Kurye Sorunu Ve Yüksek Komisyonlar;24 Ekim 2024 22:57;2.359;1.0;Yemeksepeti'nde üye iş yerimde (VF Waffle) sistem kuryesiyle çalışmaktayız. Maalesef, waffle'ı taşımak özen ister ancak kurye arkadaşlar hiç dikkat etmiyor ve sürekli sıkıntı yaşıyoruz. Sistem kuryesi ile çalıştığımızdan ötürü mesafemiz kısıtlı, müdahale edemiyoruz. Çok yüksek komisyon alınmakta ve işletmemizi zora sokmaktadır. Bu durumu, kendi kuryemiz ile çalışmak istediğimizi defalarca iletmemize rağmen, saçma sapan bahanelerle geçiremeyeceklerini söylediler. Kendi kuryem ile çalışmak istiyorum. Lütfen bu problemin çözümünü rica ediyorum. İşletme ID: ZIO3 VF Waffle;True;komisyon
30492562;Yemeksepeti İskonto Sorunu Ve Muhatap Eksikliği;28 Ekim 2024 15:01;2.901;;Uzun zamandır Yemeksepeti kuryesi ile çalışmaktayız. Yemeksepeti'nin kendi kuryesi veya bazen sistemlerin hataları yüzünden haziran ayından ekim ayına kadar iptal olan siparişlerimiz bulunmaktadır. Her seferinde iptal olan siparişler için müşteri temsilcileriniz tarafından aranıp iskonto talebi oluşturduk deniyor. Fakat kesilen faturalarda haziran ayından ekim ayına kadar incelediğimizde maalesef iskonto tutarlarının yatmadığını görüyoruz. Muhasebe departmanınızı aradığımızda karşımızda bilgi verecek ya da opsiyon sunacak birini göremiyoruz. Karşımızda muhatap bulamadığımız gibi sonuç da alamıyoruz. İskontolarımız yatmamaktadır. Örnek verecek olursak, ekim ayında 5 Ekim'den 21 Ekim'e kadar iki restoranın toplamda 5 siparişi iptal olmuştur. Bunların toplamı 2380 TL, yatan iskonto ise 458 TL'dir. Bu haksızlıktır. Son olarak, Haziran ayından bu zamana kadar her iki restoranımızın incelenmesini ve iskontolarımızın yatırılmasını talep ediyoruz.;True;komisyon
30457851;Yemek Sepeti Komisyon Oranları Hakkında Şikayet;24 Ekim 2024 10:43;3.733;;Benim bir restoranım var ve Yemek Sepeti ile hizmet veriyorum. Yaşamış olduğum sorun şu: Komisyon oranları çok yüksek. Dolayısıyla bizim kâr oranımız çok düşüyor. Onları arayıp komisyon oranlarını sorduğum zaman %20 artı 10, yani toplamda %30 bir komisyon uyguladıklarını söylüyorlar. Ama bir haftalık ciromu ve banka hesabıma yatan parayı hesapladığım zaman %59,431 bir kesinti yaptıklarını gördüm. Bununla ilgili kesin bir çözüm bekliyorum.;True;komisyon
30331373;Yemeksepeti Komisyon Ve Kurye Sorunları;10 Ekim 2024 15:31;3.660;1.0;Yemek Sepeti kendi kuryesiyle hizmet verirken aşırı derecede komisyon alıyor. Bu oran %50'leri buluyor. Hesaplarımızı net şekilde göremiyoruz. Haftalık satışlarda kendim inceledikten sonra bunu fark ettim ve sipariş almayı sonlandırdım. Kesinlikle bir muhatap bulamıyorsunuz. Detaylı ekstre istedim. 60 sayfa saçma sapan bir dosya gönderdiler. İş yapalım diye buna üye olup onların kuryesiyle çalışıyorsanız kesinlikle zarar ediyorsunuz. Ürünün durduğu yerde karı daha fazla, sadece amme hizmeti yaparsınız. Kuryeleri de ayrıca sıkıntılı, kurye pizzayı dik götürüyor. Çanta kullanmıyor, müşteriler de ürünleri bizim götürdüğümüzü sanıyor, defalarca yaşadım. %50'yi aşan komisyon maliyeti, ayrıca %10 ile de fiş keserseniz siz ne kazanacaksınız?;True;komisyon
30450882;Yemeksepeti'nde Express Dayatması Ve Haksız Komisyon;23 Ekim 2024 14:48;3.246;1.0;Yemeksepeti ile 1 yılı aşkın süredir çalışıyoruz. İş yerimiz üzerinden %40 a yakın bir komisyon almaktadır. Ekspres çalışma dayatmasına maruz bırakılıyoruz. Ekspresten çıkıp, kendi kuryemiz ile çalışma talebimiz saçma sapan cevaplarla reddediliyor. 5 iş gününde döneceğiz diyerek sürekli oyalanıyoruz. Uzun zamandır. Kuryeleri vaktinde gelmiyor ve bu yüzden iş yeri puanımız 2 ye kadar düştü. Başka hiçbir platformda bu şekil bir dayatma uygulanmazken, Yemeksepeti'nde kendi elimle girebildiğim Joker kampanyasını bile kendim kapatmama izin verilmiyor. Günlerce hatta haftalarca daha üzerimden haksız kazanca devam ediyorlar. Beni ekspresten çıkarmadıkları takdirde bundan sonra Yemeksepeti hizmetimiz kapalı olacaktır.;True;komisyon
30348887;Yemek Sepeti Express İşbirliğiyle Azalan Kazanç;12 Ekim 2024 11:45;2.667;;Yaklaşık 7 ay önce Yemek Sepeti Express ile çalışmaya başladım. Başlamaz olaydım. İşlerimde düşüş yaşadım ve kazancım yüksek derecede düşüş gösterdi. Son 5 aydır atmadığım mail , aramadığım kişi kalmadı ama bir türlü çıkamıyorum. Karşımızda hiçbir muhatap yok. İş yeri: Volkan Fast Food, Döner , Kapaklı, Tekirdağ.;True;komisyon
30278356;Yemek Sepeti'nin KDV Uygulaması Hakkında Şikayet;04 Ekim 2024 21:57;2.525;1.0;Yemek Sepeti, restorandan habersiz şekilde bazı restoranlara yüzde 24 ve ayrı olarak yüzde 18 KDV alıyor ve bazı restoranların bundan haberi yok. Sözleşmeyi size yolladıklarında yüzde 12 KDV yazıyor fakat sonra değiştiriyorlar.;True;komisyon
30224286;Yemeksepeti Joker Kullanım Bedeli;29 Eylül 2024 15:00;3.214;;Restoranım Yemeksepeti ile çalışıyor, Joker indirim kullanıyordum. Kapatmak için talepte bulundum, 4 gündür kapanmıyor. Joker bedelinden komisyon aldıkları için süreci geciktirdiklerini düşünüyorum. Acilen bu işin çözülmesini istiyorum. Teşekkürler, hızlı bir çözüm bekliyorum.;True;komisyon
30210218;Yemeksepeti Yüksek Komisyon Oranları Yemek Fiyatlarını Artırıyor!;27 Eylül 2024 18:38;3.139;1.0;Lokantalardan sipariş veriyoruz. Bunun yarısını siz kesinti yapıyorsunuz İşletmelerden. Siz bu kadar almasanız yediğimiz yemekler bu kadar haddinden fazla fiyat listeleri oluşmaz. İnsanlar etini alacak, usta, garson, dükkan, elektrik, kiraları, kömürü, sosu, domatesi, biberi her şeyi yapacak. Sen insanların emeğini internet üzerinden yarısını keseceksin. Senin giderin bunların %5 olsun, %10 kes, %15 kes. Yarısını kesmek nedir?;True;komisyon
30198840;Yemeksepeti Restoran Joker Bedeli;26 Eylül 2024 18:29;7.178;;Yemeksepeti restoran üyeliğim var. Joker kampanyasına katıldım. Komisyon+kurye+vergi alınıyor, bir de bilmediğim bir Joker bedeli adı altında Joker bedeli ücreti alınmış. Az da değil alınan ücret. Joker kampanyası'nda müşteri zaten 150 TL indirim kullanmış. Daha siz Joker bedeli olarak 161 TL niye kesiyorsunuz anlamadım. Komisyon zaten alıyorsunuz, Joker bedeli nedir? Yapılan indirimden fazla alıyorsunuz, e ben restoran sahibi olarak ne kazanıyorum? Ne kazandırıyorsunuz bana? Daha çok zarara uğradım. Yemek Sepeti'nin hiçbir avantajı yok şu saatten sonra, insanları zarara uğratıyorsunuz. Yazık.;True;komisyon
30168550;Yemek Sepeti Tarafından Ödemelerimiz Eksik Yatıyor;25 Eylül 2024 11:53;2.958;5.0;Ben restoran sahibiyim. Yemeksepeti ödemelerimizi yatırırken %58-%60 civarında komisyon kesiyor. Aradığımızda da hiç kimseye ulaşamıyoruz. Bir muhatap bulamıyoruz. Muhasebe birimine mail atıyoruz, dönüş yapılmıyor. Paramız neden eksik yatıyor, neden muhatap bulamıyoruz? Neden kimse bize dönüş yapmıyor?;True;komisyon
30162088;Yemek Sepeti Joker Aldatması;24 Eylül 2024 21:29;4.429;1.0;Yemek sepetinde ki yüksek fiyatların sebebi yemek sepetinin işletmelerden aldığı komisyon sipariş iletim bedeli Joker kullanım bedeli gibi bedellerdir. Aynı noktaya 100 liralık sipariş gitse 20 lira alırken, 1000 liralık sipariş gidince 200 lira almaktalar. Bu durum da işletme tarafından oran bazında ürünlere yansımaktadır. Joker de size indirim sunan işletmeden 200 lira için ekstra olarak 45 civarı Joker kullanım bedeli alınıyor. Bu da yine işletme tarafından kullanıcıya yansıtılıyor. İşletmeler kar edebilmek için bunu yapmak zorunda kalıyor. Yani tonla ödediğiniz paradan işletme 4 te biri ancak gidiyor kalanı yemek sepetine. Firma olarak hem jokerden indirim verip hem de indirim verdiğimiz için ys ye para ödemek istemiyoruz. Kendi kuryemiz ile sipariş iletmek istiyoruz onu da kabul etmiyorlar. Tam sansar firma.;True;komisyon
30149032;Yemeksepeti Şirketi Mağaza Firmalarından Haksız Komisyon Oranı Alıyor;23 Eylül 2024 18:03;3.820;;"Yemeksepeti işletme üyesiyim. Şu aldıkları komisyon oranlarına bir bakın, direkt Yemeksepeti'ne çalışıyor. Esnaf korkunç kârla çalışıyor. Çok büyük paralar kazanıyorlar, komisyon oranları esnafı batıran. Videolara, fotoğraflara bakın. Bana müşteri 600 TL sipariş veriyor, bana yatan tahmini kazanç 100 TL. Bütün parayı bunlar kesiyor; yok şu bedel, yok bu bedel. Devletin acil bir şekilde Yemeksepeti'ni denetlemesi lazım. Sahibinden gibi tek el olmuşlar, esnafa hep zarar. Bir de kafalarına göre: benim yanımdaki yerden yüzde 8 komisyon, bir yanımdaki yüzde 10 komisyon, benden yüzde 40 komisyon ve diğer tüm giderleri, reklam paralarını kesiyorlar. Haksızlık Yemeksepeti'nde diz boyu.";True;komisyon
29977109;Yemeksepeti Komisyon Kesintileri Ve Gelir Dağılımı Sorunu;07 Eylül 2024 16:25;4.202;;Yemek Sepeti ile işletmemizde satış yapıyoruz. Kendileri 970 TL'lik siparişten bana 298 TL veriyor. Bu 280 TL Joker kullanım ücreti diye para kesmişler hesabımdan. %38 komisyon diyorlar, %70 kesiyorlar.;True;komisyon
30017685;Yemeksepeti Kurye Sorunu;11 Eylül 2024 18:03;2.452;;Restoran sahibi olarak Yemek Sepeti'nde şikayetçiyim defalarca kendi kuryeme geçmek istedim kuryelerinde çıkarmadılar bir kurumsal firma sorumsuz. Ve bir o kadar anlayışsız olur müşteriler beni arıya şikayet ediyor bu kadar saçmalık olmaz çıkarın beni kuryenizde.;True;komisyon
29942002;Yemeksepeti İsini Sallıyor Bilgi Vermiyor;04 Eylül 2024 11:46;3.429;1.0;3-4 aydır Yemeksepeti ile çalışıyorum. İşletme olarak defalarca sorduğum, mail attığım halde net kesilen komisyon oranı hakkında bilgi alamıyorum. Partner sayfası sözleşme kısmında yazıyor diyerek otomatik mesaj gönderip duruyorlar. Orada yazıyor olsa defalarca sormazdım, işini doğru düzgün yapan yok, bilgi veren yok. Allah'a emanet bir şekilde çalışıyoruz. %40 kestiğini düşünerek fiyatlara dahil ettim ama bana yatan para hâlâ eksik. Arıyorum cevap veren yok, mail atıyorum cevap veren yok. Saçma sapan bir platform, biz girdik pişman olduk. Bilgi almak, bir şey sormak mümkün değil, kimse bilmiyor, herkes işini sallıyor. Kısaca Yemeksepeti pişmanlık. En son buraya yazdım. Net komisyon oranım buradan da bilgilendirilmezse işletmemi iptal edeceğim.;True;komisyon
